{
  "schema_version": 1,
  "receipt_id": "fria-question-update-20260919",
  "author_identity": "codex-fria-question-domain-builder",
  "evidence": [
    {
      "evidence_ref": "art27-completion-src-0011-p0222-ec-001",
      "source_id": "SRC-0011",
      "source_sha256": "bd7134beb56eaca3b859e272563e464dc234f2daee8f305b942b64eb16fc700c",
      "unit_path": "ingest/SRC-0011/units/p0222.md",
      "unit_sha256": "6337dca60a7d782f77e632a7b4b48480569df93258e8c496d4f3aa6d2f246b8d",
      "unit_file_sha256": "a036e415dec47d0a1832124f69f8df6dded0b2b64415cbfb1f064580884c7607",
      "locator": "Page 222",
      "authority": "BINDING",
      "jurisdiction": [
        "EU"
      ],
      "valid_from": null,
      "valid_until": null,
      "fidelity_inputs": [
        {
          "path": "state/workshop/proposals/fria-article27-completion-20260919/evidence/fidelity-article27-completion.json",
          "sha256": "1c724489f8047926336e711710ea48c1f2bddd6fa1b60757e023d2cb2762b704"
        }
      ]
    },
    {
      "evidence_ref": "art27-completion-src-0011-p0223-ec-008",
      "source_id": "SRC-0011",
      "source_sha256": "bd7134beb56eaca3b859e272563e464dc234f2daee8f305b942b64eb16fc700c",
      "unit_path": "ingest/SRC-0011/units/p0223.md",
      "unit_sha256": "4df5ff267fbe5dbcafc4ac2c7281da40ca9605edfd68d89cdfa08d584ea961ab",
      "unit_file_sha256": "8a5c0ba929b0b9d096d7cb38f7236be1af2a420635c58545f643e3b8022b6fec",
      "locator": "Page 223",
      "authority": "BINDING",
      "jurisdiction": [
        "EU"
      ],
      "valid_from": null,
      "valid_until": null,
      "fidelity_inputs": [
        {
          "path": "state/workshop/proposals/fria-article27-completion-20260919/evidence/fidelity-article27-completion.json",
          "sha256": "1c724489f8047926336e711710ea48c1f2bddd6fa1b60757e023d2cb2762b704"
        }
      ]
    },
    {
      "source_id": "SRC-0043",
      "source_sha256": "0bea4d808256b08275777949ba9cb3c70b7d02e4ebb3ac9b205671b1f552d386",
      "authority": "BINDING",
      "jurisdiction": [
        "EU"
      ],
      "valid_from": null,
      "valid_until": null,
      "fidelity_inputs": [
        {
          "path": "state/workshop/proposals/roadmap-article35-strict-20260919/evidence/fidelity-article35.json",
          "sha256": "fe2b6e27e03fb23fb42bd0a33e6312c7edec2e819143b5b434fb24f3d1f547fd"
        }
      ],
      "evidence_ref": "fria27-amend-src-0043-p0035-ec-001",
      "unit_path": "ingest/SRC-0043/units/p0035.md",
      "unit_sha256": "bb8788e4b98857fd2f44b21395e51a8aaac96801951382e173b159978fb90d8e",
      "unit_file_sha256": "39653650ddd6df4d8b30002799440556d67ffd56899f4600bafb5f9306d9f88b",
      "locator": "Page 35"
    }
  ],
  "bindings": [
    {
      "note_id": "legal-002-fria-trigger",
      "note_sha256": "c1f936b9a8cfefc65ab27788999391ead5fddcf6b27578b3b3fb5884a835ded3",
      "section_id": "legal-002-fria-trigger:357242d6c521fafe",
      "section_sha256": "873763f969cad24b28dfe4cfa6f308cf096827b6b5dbfef553e4c59ffa766494",
      "evidence_refs": [
        "art27-completion-src-0011-p0222-ec-001",
        "art27-completion-src-0011-p0223-ec-008"
      ],
      "modality": "context"
    },
    {
      "note_id": "legal-002-fria-trigger",
      "note_sha256": "c1f936b9a8cfefc65ab27788999391ead5fddcf6b27578b3b3fb5884a835ded3",
      "section_id": "legal-002-fria-trigger:0e2ade21fecab977",
      "section_sha256": "6cd9636310f168f5dd7ab4a0a4ce8955abc18f2cbf8eeb59e38d1f664d5ef10d",
      "evidence_refs": [
        "art27-completion-src-0011-p0222-ec-001",
        "art27-completion-src-0011-p0223-ec-008",
        "fria27-amend-src-0043-p0035-ec-001"
      ],
      "modality": "context"
    }
  ],
  "review": {
    "reviewer_identity": "codex-fria-question-independent-evidence-reviewer",
    "reviewed_at": "2026-09-19T23:50:00+02:00",
    "candidate_sha256": "de6d7e5feb506bd42e07fae1bea2ffbe39752467c839859845c7a524ff470a84",
    "verdict": "EVIDENCE_READY",
    "findings": [
      {
        "severity": "INFO",
        "code": "EXACT_INPUTS_RECHECKED",
        "detail": "All three locked references resolve to the declared validated Markdown units with matching source, content and file hashes."
      },
      {
        "severity": "INFO",
        "code": "FIDELITY_SCOPE_RECHECKED",
        "detail": "The referenced fidelity receipts cover Page 222, Page 223 and Page 35 with REVIEWED lineage rows."
      },
      {
        "severity": "INFO",
        "code": "BINDINGS_EXACT",
        "detail": "Both substantive question sections bind to reviewed evidence references; Related knowledge is navigation-only and Source references are citation lists."
      },
      {
        "severity": "INFO",
        "code": "AUTHORITY_BOUNDARY_PRESERVED",
        "detail": "The applicability and route-date qualifiers use only reviewed BINDING AI Act text and do not assert a universal FRIA obligation."
      },
      {
        "severity": "INFO",
        "code": "OBSOLETE_REFERENCES_REMOVED",
        "detail": "The candidate contains no SRC-0022 or Page 224 citation; it uses SRC-0011 Pages 222-223 and SRC-0043 Page 35."
      }
    ]
  }
}
