{
 "schema_version": 1,
 "receipt_id": "gdpr-dpia-001",
 "author_identity": "opencode-evidence-auditor-20260916",
 "evidence": [
  {
   "evidence_ref": "gdpr-dpia-src-0010-p0053",
   "source_id": "SRC-0010",
   "source_sha256": "bd84e63f5b622b739a83389afc3b30d240f792bb88d8eb03a816c9a82b0c2499",
   "unit_path": "ingest/SRC-0010/units/p0053.md",
   "unit_sha256": "cb66f30fab80fb8c30897464c5ac49121837304cffc0ad44398c0804de44ee4a",
   "unit_file_sha256": "f8fc78d7e94a0f5686155e20366218284951be467d0df51afcfb2e8ade1c6968",
   "locator": "Page 53",
   "authority": "BINDING",
   "jurisdiction": [
    "EU"
   ],
   "valid_from": null,
   "valid_until": null,
   "fidelity_inputs": [
    {
     "path": "state/workshop/brain-upgrade/pilot2-legal-fidelity.json",
     "sha256": "328a3586cb554434815f06efb5b63b25c8d5089180c9b0a29dc4da7fff4c5a10"
    }
   ]
  },
  {
   "evidence_ref": "gdpr-dpia-src-0010-p0054",
   "source_id": "SRC-0010",
   "source_sha256": "bd84e63f5b622b739a83389afc3b30d240f792bb88d8eb03a816c9a82b0c2499",
   "unit_path": "ingest/SRC-0010/units/p0054.md",
   "unit_sha256": "667eddb7c78d5c54b0978d37afaa20a42d52fd7581b58d548d06a9ed3a1c333f",
   "unit_file_sha256": "f8e710000dd9b6754bf45a1ed12ed2fdffa8434f8e47dc502202f949d13c232f",
   "locator": "Page 54",
   "authority": "BINDING",
   "jurisdiction": [
    "EU"
   ],
   "valid_from": null,
   "valid_until": null,
   "fidelity_inputs": [
    {
     "path": "state/workshop/brain-upgrade/pilot2-legal-fidelity.json",
     "sha256": "328a3586cb554434815f06efb5b63b25c8d5089180c9b0a29dc4da7fff4c5a10"
    }
   ]
  }
 ],
 "bindings": [
  {
   "note_id": "data-protection-impact-assessments-dpia",
   "note_sha256": "e0f78d844927103763cec97e4c15206d9eaea130516ba0257b6b58b573886bec",
   "section_id": "data-protection-impact-assessments-dpia:c59a3efbe3b0ba4c",
   "section_sha256": "27f662e46da1d93184851ac9c3f7d00145601da0ef708babb5c5214d23ee89a7",
   "evidence_refs": [
    "gdpr-dpia-src-0010-p0053",
    "gdpr-dpia-src-0010-p0054"
   ],
   "modality": "obligation"
  },
  {
   "note_id": "data-protection-impact-assessments-dpia",
   "note_sha256": "e0f78d844927103763cec97e4c15206d9eaea130516ba0257b6b58b573886bec",
   "section_id": "data-protection-impact-assessments-dpia:7bf08b16f63e0801",
   "section_sha256": "b19441ff9e8cf07db107d5a54e091b8283eebb391271c341fc9d495a5b3d6d99",
   "evidence_refs": [
    "gdpr-dpia-src-0010-p0053"
   ],
   "modality": "context"
  }
 ],
 "review": {
  "reviewer_identity": "opencode-pilot2-evidence-review",
  "reviewed_at": "2026-09-16T01:00:00+00:00",
  "candidate_sha256": "a8fe0708dacf645c52fd829291067894060a4c46ca5eef82d188025e1b1d5c85",
  "verdict": "EVIDENCE_READY",
  "findings": [
   {
    "severity": "INFO",
    "code": "REDUCED_CANDIDATE_REVALIDATED",
    "detail": "Evidence array remains identical at 2 items; the two previously rejected bindings were removed and the two previously verified bindings remain unchanged."
   },
   {
    "severity": "INFO",
    "code": "EVIDENCE_ITEMS_VERIFIED",
    "evidence_items_total": 2,
    "evidence_items_verified": 2
   },
   {
    "severity": "INFO",
    "code": "SECTION_BINDINGS_VERIFIED",
    "bindings_total": 2,
    "bindings_verified": 2,
    "section_verdicts": [
     {
      "section_id": "data-protection-impact-assessments-dpia:c59a3efbe3b0ba4c",
      "verdict": "VERIFIED"
     },
     {
      "section_id": "data-protection-impact-assessments-dpia:7bf08b16f63e0801",
      "verdict": "VERIFIED"
     }
    ]
   },
   {
    "severity": "INFO",
    "code": "EXCLUDED_SECTION_REMAINS_UNRESOLVED",
    "section_id": "data-protection-impact-assessments-dpia:8325508b20ff2eca",
    "detail": "Unsupported editorial inference remains unbound."
   },
   {
    "severity": "INFO",
    "code": "EXCLUDED_SECTION_REMAINS_UNRESOLVED",
    "section_id": "data-protection-impact-assessments-dpia:1a3f4fa25d186826",
    "detail": "Unsupported editorial inference remains unbound."
   },
   {
    "severity": "INFO",
    "code": "EXCLUDED_SECTION_REMAINS_UNRESOLVED",
    "section_id": "data-protection-impact-assessments-dpia:46e4734e319ebd7a",
    "detail": "Editorial governance recommendation remains unbound."
   },
   {
    "severity": "INFO",
    "code": "EXCLUDED_SECTION_REMAINS_UNRESOLVED",
    "section_id": "data-protection-impact-assessments-dpia:072c36cb699b8fe3",
    "detail": "Editorial governance recommendation remains unbound."
   },
   {
    "severity": "WARNING",
    "code": "LEGAL_CURRENCY_UNKNOWN",
    "source_id": "SRC-0010",
    "evidence_items": 2,
    "detail": "valid_from and valid_until are null; legal currency dates remain unknown and were not verified."
   },
   {
    "severity": "WARNING",
    "code": "FIDELITY_SCOPE_LIMITED",
    "fidelity_file": "state/workshop/brain-upgrade/pilot2-legal-fidelity.json",
    "detail": "Token agreement does not establish layout fidelity or legal correctness."
   },
   {
    "severity": "INFO",
    "code": "BOUNDED_REVIEW_ONLY",
    "detail": "Review is limited to the assigned local corpus and does not grant publication approval or broader completeness."
   }
  ]
 }
}
