{
  "author_identity": "codex-qualification-rights-evidence-extractor",
  "bindings": [
    {
      "evidence_refs": ["qrights-src-0010-p0046"],
      "modality": "context",
      "note_id": "gdpr-article-22-automated-decision-making",
      "note_sha256": "f394b9a613603887b0c8d8fca6916f570ff38e79a40d5c3ac7207492d8e3e23e",
      "section_id": "gdpr-article-22-automated-decision-making:a4d4c0199d9d0b6b",
      "section_sha256": "ddd29a2d7f75409da1c0842989a9d366e930b4172f93d9f0e58339bd937c182c"
    },
    {
      "evidence_refs": ["qrights-src-0010-p0046"],
      "modality": "context",
      "note_id": "gdpr-article-22-automated-decision-making",
      "note_sha256": "f394b9a613603887b0c8d8fca6916f570ff38e79a40d5c3ac7207492d8e3e23e",
      "section_id": "gdpr-article-22-automated-decision-making:9d01d4573d7a6c05",
      "section_sha256": "3f4e8d1dc11bb0a86861505e83b48cbf6a7e962fe181c40e005ce368f4c0da97"
    },
    {
      "evidence_refs": ["qrights-src-0010-p0046"],
      "modality": "obligation",
      "note_id": "gdpr-article-22-automated-decision-making",
      "note_sha256": "f394b9a613603887b0c8d8fca6916f570ff38e79a40d5c3ac7207492d8e3e23e",
      "section_id": "gdpr-article-22-automated-decision-making:f59b6ba3d021d100",
      "section_sha256": "601df22982d3f94cf47f9bd35ff71c2466ec5c9bbc281641aa93acf75df9dc57"
    },
    {
      "evidence_refs": ["qrights-src-0010-p0046", "qrights-src-0010-p0063"],
      "modality": "recommendation",
      "note_id": "gdpr-article-22-automated-decision-making",
      "note_sha256": "f394b9a613603887b0c8d8fca6916f570ff38e79a40d5c3ac7207492d8e3e23e",
      "section_id": "gdpr-article-22-automated-decision-making:6b0fbc132f881d48",
      "section_sha256": "62e29daabc28aa13423e1a0f4b5f97e95b73c4860f41c59950623e9b8960c507"
    },
    {
      "evidence_refs": ["qrights-src-0010-p0016", "qrights-src-0010-p0018", "qrights-src-0010-p0046"],
      "modality": "context",
      "note_id": "gdpr-article-22-automated-decision-making",
      "note_sha256": "f394b9a613603887b0c8d8fca6916f570ff38e79a40d5c3ac7207492d8e3e23e",
      "section_id": "gdpr-article-22-automated-decision-making:9481f92a41a9e00d",
      "section_sha256": "0c1f8a62cef42212775c992d89d687fb59afb7d352311246c77dc5ee18b82ab1"
    }
  ],
  "evidence": [
    {
      "authority": "BINDING",
      "evidence_ref": "qrights-src-0010-p0016",
      "fidelity_inputs": [{"path": "state/workshop/brain-upgrade/gdpr-pilot-fidelity.json", "sha256": "772492156c42a984bbc96050dc9b489fe4a753c39172ca399c02bd96e2ce749a"}],
      "jurisdiction": ["EU"],
      "locator": "Page 16",
      "source_id": "SRC-0010",
      "source_sha256": "bd84e63f5b622b739a83389afc3b30d240f792bb88d8eb03a816c9a82b0c2499",
      "unit_file_sha256": "d0688c4eb87be1ef5b0e52a7a568de8d12b7d176dd34ac684badf97bc6b2f1a6",
      "unit_path": "ingest/SRC-0010/units/p0016.md",
      "unit_sha256": "19e67c2247679cca0cae8ce3ab4b7e609a431de1a1c1ae08db31a0cc721fe233",
      "valid_from": null,
      "valid_until": null
    },
    {
      "authority": "BINDING",
      "evidence_ref": "qrights-src-0010-p0018",
      "fidelity_inputs": [{"path": "state/workshop/brain-upgrade/gdpr-pilot-fidelity.json", "sha256": "772492156c42a984bbc96050dc9b489fe4a753c39172ca399c02bd96e2ce749a"}],
      "jurisdiction": ["EU"],
      "locator": "Page 18",
      "source_id": "SRC-0010",
      "source_sha256": "bd84e63f5b622b739a83389afc3b30d240f792bb88d8eb03a816c9a82b0c2499",
      "unit_file_sha256": "e3da33167b1f1bfd91f75d50b6b8d349faa9fba35055a4c7b14f8bda636303d1",
      "unit_path": "ingest/SRC-0010/units/p0018.md",
      "unit_sha256": "9a17b098fb1ba94729535f66a26946a7869a95de57b6ce1b6f4c4c0a81ff1f86",
      "valid_from": null,
      "valid_until": null
    },
    {
      "authority": "BINDING",
      "evidence_ref": "qrights-src-0010-p0046",
      "fidelity_inputs": [{"path": "state/workshop/brain-upgrade/gdpr-pilot-fidelity.json", "sha256": "772492156c42a984bbc96050dc9b489fe4a753c39172ca399c02bd96e2ce749a"}],
      "jurisdiction": ["EU"],
      "locator": "Page 46",
      "source_id": "SRC-0010",
      "source_sha256": "bd84e63f5b622b739a83389afc3b30d240f792bb88d8eb03a816c9a82b0c2499",
      "unit_file_sha256": "121aa50e9262e71b1336bb7438e82a6901629c92d30aad18336c60fa682b8f0b",
      "unit_path": "ingest/SRC-0010/units/p0046.md",
      "unit_sha256": "406c57dad0e00f1f18d34035072c090a992088c9e0b8fd5544e00e0b2e46139d",
      "valid_from": null,
      "valid_until": null
    },
    {
      "authority": "BINDING",
      "evidence_ref": "qrights-src-0010-p0063",
      "fidelity_inputs": [{"path": "state/workshop/brain-upgrade/gdpr-pilot-fidelity.json", "sha256": "772492156c42a984bbc96050dc9b489fe4a753c39172ca399c02bd96e2ce749a"}],
      "jurisdiction": ["EU"],
      "locator": "Page 63",
      "source_id": "SRC-0010",
      "source_sha256": "bd84e63f5b622b739a83389afc3b30d240f792bb88d8eb03a816c9a82b0c2499",
      "unit_file_sha256": "efb49f201a5e4f62ee0a05d652c0fc57627fe776a01f7bef26127a5f65ade509",
      "unit_path": "ingest/SRC-0010/units/p0063.md",
      "unit_sha256": "bfb650cd49f3cde131c48899457b2032d19c5d30fd363640d242555eff7fd02f",
      "valid_from": null,
      "valid_until": null
    }
  ],
  "receipt_id": "gdpr-article22-governance-001",
  "review": {
    "candidate_sha256": "4b7607edc4142f57eb058e21fb210fe05d862bc8eb05d426e8a5c05f7437a9ec",
    "findings": [
      {
        "code": "EVIDENCE_ITEMS_VERIFIED",
        "count": 4,
        "severity": "INFO"
      },
      {
        "code": "SECTION_BINDINGS_VERIFIED",
        "count": 5,
        "severity": "INFO"
      },
      {
        "code": "SOURCE_AUTHORITY_CONFIRMED",
        "detail": "All four retained units are from the reviewed BINDING SRC-0010 GDPR text; the obligation binding cites Page 46 only.",
        "severity": "INFO"
      },
      {
        "code": "GOVERNANCE_SECTION_REPAIRED",
        "detail": "The rewritten Governance considerations section is bounded to recording and routing practices supported by Article 22 operative text and binding-corporate-rules content.",
        "severity": "INFO"
      },
      {
        "code": "LEGAL_CURRENCY_UNKNOWN",
        "detail": "valid_from and valid_until remain null; current amendments and supervisory interpretations were not assessed.",
        "severity": "WARNING"
      },
      {
        "code": "FIDELITY_SCOPE_LIMITED",
        "detail": "The local fidelity receipt records token agreement only; it does not establish layout fidelity or legal correctness.",
        "severity": "WARNING"
      }
    ],
    "reviewed_at": "2026-09-17T00:00:00+00:00",
    "reviewer_identity": "codex-qualification-rights-evidence-auditor",
    "verdict": "EVIDENCE_READY"
  },
  "schema_version": 1
}
